{
  "$schema": "../plugin.schema.json",
  "schemaVersion": 1,
  "id": "aliyun_thoughts",
  "name": "阿里云 Thoughts",
  "description": "阿里云 Thoughts 工作区 Markdown 导出。",
  "version": "1.0.5",
  "publisher": "Wandao Official",
  "license": "AGPL-3.0-only",
  "core": { "minVersion": "1.2.9" },
  "platforms": ["win32", "darwin", "linux"],
  "entrypoints": { "providers": ["providers/aliyun/provider.json"] },
  "permissions": ["browser-automation", "credentials", "filesystem:write", "network", "process"]
}
