{
  "schemaVersion": 1,
  "id": "xiliu",
  "name": "息流",
  "description": "导出/导入 FlowUs (息流) 文档，保留目录结构。",
  "version": "1.0.2",
  "publisher": "tllovesxs",
  "core": { "minVersion": "1.3.2" },
  "entrypoints": {
    "providers": [
      "providers/xiliu/provider.json",
      "providers/xiliu-import/provider.json"
    ]
  },
  "permissions": ["browser-automation", "credentials", "filesystem:write", "network", "process"]
}
