{
  "$schema": "../plugin.schema.json",
  "schemaVersion": 1,
  "id": "onenote",
  "name": "OneNote",
  "description": "Windows 桌面版 OneNote 本地 Markdown 导出。",
  "version": "1.0.6",
  "publisher": "Wandao Official",
  "homepage": "https://www.onenote.com/",
  "license": "AGPL-3.0-only",
  "core": { "minVersion": "1.2.9" },
  "platforms": ["win32"],
  "entrypoints": { "providers": ["providers/onenote/provider.json"] },
  "permissions": ["filesystem:read", "filesystem:write", "process"]
}
